id,speaker_nm,conversation_id,reply_to_nm,timestamp,text,likes,shares,num_comments,cleaned_text,named_entities,sentiment,tokens
1346224988559437827,r1chardeldridge,1346221141208281092,thehill,2021-01-04 22:40:23,"Members of Congress have the authority to declare war. Is someone saying they can't be trusted to carry a firearm? Furthermore, they are high profile people who make decisions that affect, for good or bad, the lives of billions of people. They should be armed.",0,0,0,members congress authority declare war saying trusted carry firearm furthermore high profile people make decisions affect good bad lives billions people armed,"[('Congress', 'ORG'), ('billions', 'CARDINAL')]",0.05333333333333338,"[101, 2372, 3519, 3691, 13520, 2162, 3038, 9480, 4287, 23646, 7297, 2152, 6337, 2111, 2191, 6567, 7461, 2204, 2919, 3268, 25501, 2111, 4273, 102]"
1346225347751268354,Lucianowrites,1346221141208281092,thehill,2021-01-04 22:41:49,"This is expressly illegal, incredibly so, and it is amazingly dangerous for her to try and do this. Jesus Fucking Christ.",0,0,0,expressly illegal incredibly amazingly dangerous try jesus fucking christ,"[('Jesus Fucking Christ', 'PERSON')]",-0.19999999999999998,"[101, 4671, 2135, 6206, 11757, 29350, 4795, 3046, 4441, 8239, 4828, 102]"
1346249110228111361,Byb2021,1346221141208281092,thehill,2021-01-05 00:16:14,Just another “loca”...,0,0,0,just loca,[],0.0,"[101, 2074, 8840, 3540, 102]"
1339763837856342017,thehill,1339763837856342017,None,2020-12-18 02:46:05,Atlantic City auctions off chance to blow up Trump Plaza http://hill.cm/iDyrWaf,162,38,17,atlantic city auctions chance blow trump plaza,"[('Atlantic City', 'GPE'), ('Trump Plaza http://hill.cm/iDyrWaf', 'FAC')]",0.0,"[101, 4448, 2103, 10470, 2015, 3382, 6271, 8398, 8232, 102]"
1339764086721003521,DavidHull50,1339763837856342017,thehill,2020-12-18 02:47:04,Will trump be in there?,6,0,1,trump,[],0.0,"[101, 8398, 102]"
1339765054309359617,fastballhitter1,1339763837856342017,thehill,2020-12-18 02:50:55,Shouldn’t need more than a bit of wind.,4,0,0,shouldnt need bit wind,[],0.5,"[101, 5807, 2102, 2342, 2978, 3612, 102]"
1339765354902540288,ErinReadsStuff,1339763837856342017,thehill,2020-12-18 02:52:06,"I will pay $800M. 

Unrelated: can anyone lend me $799.99M",3,0,0,pay 800m unrelated lend 79999m,"[('800M.', 'MONEY'), ('$799.99M', 'MONEY')]",0.0,"[101, 3477, 5385, 2213, 15142, 18496, 6535, 2683, 2683, 2683, 2213, 102]"
1339765845380255745,pans44,1339763837856342017,thehill,2020-12-18 02:54:03,Greatness,0,0,0,greatness,"[('Greatness', 'ORG')]",0.0,"[101, 2307, 2791, 102]"
1339766026582560768,mydogisgorgeous,1339763837856342017,thehill,2020-12-18 02:54:47,hahahhahahaha. What a phuqqing #moron Maybe HE should push the button ,0,0,0,hahahhahahaha phuqqing moron maybe push button,"[('moron', 'PERSON')]",-0.8,"[101, 5292, 3270, 23644, 23278, 3270, 3270, 6887, 2226, 4160, 19784, 22822, 2239, 2672, 5245, 6462, 102]"
1339769198839513088,OverboostedOne,1339763837856342017,thehill,2020-12-18 03:07:23,"So 
@realDonaldTrump
 makes the mistake of trying to revitalize the armpit of America and this is his thanks. Nice.

Atlantic City is DEAD and Trump isn't the only one who lost their shirt on that shithole.",0,0,0,realdonaldtrump makes mistake trying revitalize armpit america thanks nice atlantic city dead trump isnt lost shirt shithole,"[('@realDonaldTrump\n ', 'PERSON'), ('America', 'GPE'), ('Atlantic City', 'GPE'), ('DEAD', 'ORG'), ('Trump', 'ORG')]",0.15000000000000002,"[101, 2613, 5280, 19058, 24456, 2361, 3084, 6707, 2667, 7065, 18400, 4697, 2849, 23270, 2637, 4283, 3835, 4448, 2103, 2757, 8398, 3475, 2102, 2439, 3797, 4485, 11484, 102]"
1339775477892964353,WriterTrans,1339763837856342017,thehill,2020-12-18 03:32:20,If feels likre everything will refute be be hey,0,0,0,feels likre refute hey,"[('likre everything', 'PERSON')]",0.0,"[101, 5683, 5622, 21638, 2063, 25416, 10421, 4931, 102]"
1339764427738894336,obsceneporn,1339763837856342017,thehill,2020-12-18 02:48:25,This is doing incredible damage to our country and the presidency. Despicable and dangerous.,0,0,0,doing incredible damage country presidency despicable dangerous,[],0.15000000000000002,"[101, 2725, 9788, 4053, 2406, 8798, 4078, 24330, 3085, 4795, 102]"
1339764962345050114,FedUpPatriot717,1339763837856342017,thehill,2020-12-18 02:50:33,"Democrats are such sick, disgusting people.",0,0,0,democrats sick disgusting people,"[('Democrats', 'NORP')]",-0.5714285714285715,"[101, 8037, 5305, 19424, 2111, 102]"
1339766841762148352,sue52491494,1339763837856342017,thehill,2020-12-18 02:58:01,Where is Bill Gates!?,0,0,0,gates,"[('Bill Gates', 'PERSON')]",0.0,"[101, 6733, 102]"
1339807873757540352,thehill,1339807873757540352,None,2020-12-18 05:41:04,Atlantic City auctions off chance to blow up Trump Plaza http://hill.cm/VV7OfDX,169,42,17,atlantic city auctions chance blow trump plaza,"[('Atlantic City', 'GPE'), ('Trump Plaza', 'FAC')]",0.0,"[101, 4448, 2103, 10470, 2015, 3382, 6271, 8398, 8232, 102]"
1339808597958565888,ScottysParadigm,1339807873757540352,thehill,2020-12-18 05:43:56,How much to do NY tRump tower too? (Kidding) ,2,0,0,ny trump tower kidding,"[('NY', 'GPE')]",0.2,"[101, 6396, 8398, 3578, 12489, 102]"
1339808107388661761,cam_03w,1339807873757540352,thehill,2020-12-18 05:41:59,Can I start the bid at $1 that’s how much all trump property is worth ,1,0,1,start bid 1 thats trump property worth,"[('1', 'MONEY')]",0.25,"[101, 2707, 7226, 1015, 2008, 2015, 8398, 3200, 4276, 102]"
1339809093704364033,FabFreddy4,1339807873757540352,thehill,2020-12-18 05:45:55,".
@realDonaldTrump
 another failure of yours. Man it never ends well with you.",1,0,0,realdonaldtrump failure man ends,"[('@realDonaldTrump\n ', 'PERSON')]",-0.3166666666666667,"[101, 2613, 5280, 19058, 24456, 2361, 4945, 2158, 4515, 102]"
1339811030264737793,orangeblutattoo,1339807873757540352,thehill,2020-12-18 05:53:36,"Which reminds me, Trump opened the Taj Mahal casino in 1990, and roughly a year later it went bankrupt.  How the hell do you do that?",1,0,1,reminds trump opened taj mahal casino 1990 roughly year later went bankrupt hell,"[('Trump', 'PERSON'), ('Taj Mahal', 'ORG'), ('1990', 'DATE'), ('roughly a year later', 'DATE')]",-0.05,"[101, 15537, 8398, 2441, 11937, 3501, 27913, 9270, 2901, 5560, 2095, 2101, 2253, 17482, 3109, 102]"
1339808415435120640,DaMidKidDB1,1339807873757540352,thehill,2020-12-18 05:43:13,pay me what he owes and I'll pay attention,0,0,1,pay owes ill pay attention,[],0.0,"[101, 3477, 24381, 5665, 3477, 3086, 102]"
1339808991166275585,pookeypies7,1339807873757540352,thehill,2020-12-18 05:45:30,Wuttt? Posting this?,0,0,0,wuttt posting,[],0.0,"[101, 8814, 4779, 2102, 14739, 102]"
1339812248408252418,jenoakley81,1339807873757540352,thehill,2020-12-18 05:58:27,The one time I don’t have extra cash ,0,0,0,time dont extra cash,"[('one', 'CARDINAL')]",0.0,"[101, 2051, 2123, 2102, 4469, 5356, 102]"
1339826302489145344,heels_my,1339807873757540352,thehill,2020-12-18 06:54:17,"This, the mark of a 'successful' business man... he's full of shit and his failed, abandoned properties are landmarks of his immense failures.",0,0,0,mark successful business man hes shit failed abandoned properties landmarks immense failures,[],0.08000000000000003,"[101, 2928, 3144, 2449, 2158, 2002, 2015, 4485, 3478, 4704, 5144, 16209, 14269, 15428, 102]"
1339811006328025089,CasieKay8,1339807873757540352,thehill,2020-12-18 05:53:31,Democrats are riddled with mental illness.,0,0,0,democrats riddled mental illness,"[('Democrats', 'NORP')]",-0.1,"[101, 8037, 21834, 2094, 5177, 7355, 102]"
1339815177508823040,TreatTod,1339807873757540352,thehill,2020-12-18 06:10:05,What’s great is he’s still a billionaire and you’re all a bunch of losers and you’re poor,0,0,0,whats great hes billionaire youre bunch losers youre poor,[],0.0666666666666667,"[101, 2054, 2015, 2307, 2002, 2015, 22301, 2115, 2063, 9129, 23160, 2115, 2063, 3532, 102]"
1339987827581444096,TreatTod,1339807873757540352,thehill,2020-12-18 17:36:08,Always remember Trump is a billionaire president that gets to screw a supermodel every night you you’re a keyboard warrior a failure and you have absolutely nothing and no money,0,0,0,remember trump billionaire president gets screw supermodel night youre keyboard warrior failure absolutely money,"[('Trump', 'PERSON'), ('every night', 'TIME')]",-0.05833333333333335,"[101, 3342, 8398, 22301, 2343, 4152, 11224, 3565, 5302, 9247, 2305, 2115, 2063, 9019, 6750, 4945, 7078, 2769, 102]"
1342477473292890112,thehill,1342477473292890112,None,2020-12-25 14:29:06,"Anger at Trump and lawmakers mounts among governors: ""I’ve never been so disgusted with Congress"" http://hill.cm/8gvguEG",182,39,26,anger trump lawmakers mounts governors ive disgusted congress,"[('Trump', 'ORG'), ('Congress', 'ORG')]",-0.85,"[101, 4963, 8398, 2375, 12088, 19363, 11141, 4921, 2063, 17733, 3519, 102]"
1342477900868685826,Grey_Obelisk,1342477473292890112,thehill,2020-12-25 14:30:48,Stop saying Congress.  The fault is 100% Republicans in Congress.,16,0,0,stop saying congress fault 100 republicans congress,"[('Congress', 'ORG'), ('100%', 'PERCENT'), ('Republicans', 'NORP'), ('Congress', 'ORG')]",0.0,"[101, 2644, 3038, 3519, 6346, 2531, 10643, 3519, 102]"
1342477979910332416,DietrichAdonis,1342477473292890112,thehill,2020-12-25 14:31:07,If Governors are disgusted...think of the millions of Americans who were counting on that #StimulusPackage,10,0,0,governors disgustedthink millions americans counting stimuluspackage,"[('Governors', 'PERSON'), ('millions', 'CARDINAL'), ('Americans', 'NORP'), ('StimulusPackage', 'ORG')]",0.0,"[101, 11141, 17733, 15222, 8950, 8817, 4841, 10320, 19220, 23947, 4270, 102]"
1342481017005895680,MPFIED,1342477473292890112,thehill,2020-12-25 14:43:11,It's Trump and Republicans in Congress. Be specific when you are directing your ire.,8,0,0,trump republicans congress specific directing ire,"[('Trump', 'PERSON'), ('Republicans', 'NORP'), ('Congress', 'ORG')]",0.0,"[101, 8398, 10643, 3519, 3563, 9855, 20868, 2063, 102]"
1342480631385776128,gerilarkin,1342477473292890112,thehill,2020-12-25 14:41:39,"There's nothing you can do. They don't care about the people. They are evil men playing chess with Americans lives, while getting richer.",2,1,0,theres dont care people evil men playing chess americans lives getting richer,"[('Americans', 'NORP')]",-1.0,"[101, 2045, 2015, 2123, 2102, 2729, 2111, 4763, 2273, 2652, 7433, 4841, 3268, 2893, 26108, 102]"
1342482602507325443,DavisLilian,1342477473292890112,thehill,2020-12-25 14:49:29,We are all disgusted..,2,0,0,disgusted,[],-1.0,"[101, 17733, 102]"
1342482727287848961,NaplesGreta,1342477473292890112,thehill,2020-12-25 14:49:58,AMAZING- interviewees requested anonymity so as not to anger Trump or republicans in Congress......,2,0,0,amazing interviewees requested anonymity anger trump republicans congress,"[('Trump', 'PERSON'), ('republicans', 'NORP'), ('Congress', 'ORG')]",-0.04999999999999993,"[101, 6429, 4357, 10285, 7303, 2019, 16585, 16383, 4963, 8398, 10643, 3519, 102]"
1342494036771434497,lesliekaren,1342477473292890112,thehill,2020-12-25 15:34:55,"“The chief of staff, ... asked for anonymity to avoid angering both Trump and Senate Republicans, who said they won’t consider new aid to state & local governments”

Why is everybody so afraid of 45? What am I missing? He IS just a man, right?  Crazy, but still just a man. ",1,0,0,chief staff asked anonymity avoid angering trump senate republicans said wont consider new aid state local governments everybody afraid 45 missing just man right crazy just man,"[('Trump', 'ORG'), ('Senate', 'ORG'), ('Republicans', 'NORP'), ('45', 'CARDINAL')]",-0.16298701298701299,"[101, 2708, 3095, 2356, 2019, 16585, 16383, 4468, 4963, 2075, 8398, 4001, 10643, 2056, 2180, 2102, 5136, 2047, 4681, 2110, 2334, 6867, 7955, 4452, 3429, 4394, 2074, 2158, 2157, 4689, 2074, 2158, 102]"
1342504533918887939,GlasstetterMark,1342477473292890112,thehill,2020-12-25 16:16:38,At least the Democrats were ready with $2000.,1,0,1,democrats ready 2000,"[('Democrats', 'NORP'), ('2000', 'MONEY')]",-0.04999999999999999,"[101, 8037, 3201, 2456, 102]"
1342511365202829315,aprlegalview,1342477473292890112,thehill,2020-12-25 16:43:46,They need to specifiy. They should be angry at Trump and Republican lawmakers.,1,0,0,need specifiy angry trump republican lawmakers,"[('Trump', 'ORG'), ('Republican', 'NORP')]",-0.5,"[101, 2342, 28699, 10128, 28008, 4854, 8398, 3951, 2375, 12088, 102]"
1342556989830918145,thehill,1342556989830918145,None,2020-12-25 19:45:04,"Anger at Trump and lawmakers mounts among governors: ""I’ve never been so disgusted with Congress"" http://hill.cm/F1UNtB5",155,39,31,anger trump lawmakers mounts governors ive disgusted congress,"[('Trump', 'ORG'), ('Congress', 'ORG')]",-0.85,"[101, 4963, 8398, 2375, 12088, 19363, 11141, 4921, 2063, 17733, 3519, 102]"
1342558475960918017,Therealbp65,1342556989830918145,thehill,2020-12-25 19:50:58,I’ve never been so angry at governors and mayors.  This is all THEIR fault from the get-go!,11,0,0,ive angry governors mayors fault getgo,[],-0.625,"[101, 4921, 2063, 4854, 11141, 21941, 6346, 2131, 3995, 102]"
1342561283959386112,AMcCorm77526975,1342556989830918145,thehill,2020-12-25 20:02:08,"Don’t they mean 
@SenateGOP
 instead of “Congress”?
@HouseDemocrats
 @SpeakerPelosi
 had the HEROS BILL which included $1200 individual stimulus, $600 Unemployment Insurance add-on AND funds for State/Local Govts.
passed and sent the Senate in MAY where @senatemajldr SAT ON IT.",5,1,1,dont mean senategop instead congress housedemocrats speakerpelosi heros included 1200 individual stimulus 600 unemployment insurance addon funds statelocal govts passed sent senate senatemajldr sat,"[('Congress', 'ORG'), ('@HouseDemocrats\n @SpeakerPelosi\n ', 'MONEY'), ('HEROS', 'ORG'), ('1200', 'MONEY'), ('600', 'MONEY'), ('State/Local Govts', 'ORG'), ('Senate', 'ORG'), ('MAY', 'DATE')]",-0.15625,"[101, 2123, 2102, 2812, 4001, 3995, 2361, 2612, 3519, 7431, 6633, 10085, 8609, 2015, 5882, 11880, 20049, 5394, 2015, 2443, 14840, 3265, 19220, 5174, 12163, 5427, 5587, 2239, 5029, 2110, 4135, 9289, 22410, 2015, 2979, 2741, 4001, 4001, 2863, 3501, 6392, 2099, 2938, 102]"
1342558865309708290,sandhillshrink,1342556989830918145,thehill,2020-12-25 19:52:31,Should have been. McConnell and his band of fascists have been operating for decades.,3,0,0,mcconnell band fascists operating decades,"[('McConnell', 'PERSON'), ('decades', 'DATE')]",0.0,"[101, 28514, 2316, 14870, 2015, 4082, 5109, 102]"
1342562647066099712,TheUnitedWhirld,1342556989830918145,thehill,2020-12-25 20:07:33,"When you say ""the federal government had not made a single step"" don't you mean the GOP?",3,0,0,say federal government single step dont mean gop,"[('GOP', 'ORG')]",-0.1919642857142857,"[101, 2360, 2976, 2231, 2309, 3357, 2123, 2102, 2812, 2175, 2361, 102]"
1342557077223469060,shanetweetsall,1342556989830918145,thehill,2020-12-25 19:45:25,We all feel the same,1,0,0,feel,[],0.0,"[101, 2514, 102]"
1342559183481294855,linderje,1342556989830918145,thehill,2020-12-25 19:53:47,"""The federal government has not made a single step of the process of dealing with this pandemic easier. Not one single step.” So ... getting you PPE and masks and ventilators and hospital ships mean nothing? You are looking for cash so you can keep everyone locked down. SORRY!",1,0,1,federal government single step process dealing pandemic easier single step getting ppe masks ventilators hospital ships mean looking cash locked sorry,"[('one', 'CARDINAL'), ('PPE', 'ORG')]",-0.2471825396825397,"[101, 2976, 2231, 2309, 3357, 2832, 7149, 6090, 3207, 7712, 6082, 2309, 3357, 2893, 4903, 2063, 15806, 18834, 11733, 6591, 2902, 3719, 2812, 2559, 5356, 5299, 3374, 102]"
1342568595759493120,Nett0yan7,1342556989830918145,thehill,2020-12-25 20:31:11,"When a con man who has destroyed everything he has ever touched, is elected president of the US, WTF DID THEY EXPECT?",1,0,0,man destroyed touched elected president wtf did expect,"[('US', 'GPE')]",-0.5,"[101, 2158, 3908, 5028, 2700, 2343, 1059, 24475, 2106, 5987, 102]"
1342557309885706247,duarteddf,1342556989830918145,thehill,2020-12-25 19:46:20,25/12/2020 | MEGA CULTO GLOBAL DE NATAL COM OS PROFETAS DO SENHOR | #GloriousChristmasService,0,0,0,25122020 mega culto global natal com os profetas senhor gloriouschristmasservice,"[('25/12/2020', 'CARDINAL'), ('CULTO GLOBAL DE NATAL COM OS', 'ORG')]",0.0,"[101, 22582, 19317, 2692, 11387, 13164, 8754, 2080, 3795, 17489, 4012, 9808, 11268, 12928, 2015, 12411, 16368, 14013, 26654, 9335, 8043, 7903, 2063, 102]"
1342559907342675968,psbono21,1342556989830918145,thehill,2020-12-25 19:56:40,"USA has never been so embarrassed , ashamed , disgusted w/ a potus .",0,0,0,usa embarrassed ashamed disgusted w potus,"[('USA', 'GPE')]",-1.0,"[101, 3915, 10339, 14984, 17733, 1059, 8962, 2271, 102]"
1342560207281512449,JohnWDawkins,1342556989830918145,thehill,2020-12-25 19:57:51,Pathetic Loser.,0,0,0,pathetic loser,"[('Pathetic Loser', 'ORG')]",-1.0,"[101, 17203, 10916, 102]"
1346141862562828290,thehill,1346141862562828290,None,2021-01-04 17:10:04,Georgia Democratic lawmaker to seek censure of Trump over Georgia call http://hill.cm/mlhS2Ff,151,40,19,georgia democratic lawmaker seek censure trump georgia,"[('Georgia', 'GPE'), ('Democratic', 'NORP'), ('Trump', 'ORG'), ('Georgia', 'GPE')]",0.0,"[101, 4108, 3537, 2375, 8571, 6148, 8292, 3619, 5397, 8398, 4108, 102]"
1346142176686735360,PaulPanusorn,1346141862562828290,thehill,2021-01-04 17:11:19,Trump committed felony election tampering!,0,0,0,trump committed felony election tampering,[],0.0,"[101, 8398, 5462, 24648, 2602, 17214, 4842, 2075, 102]"
1346142261491367936,cuidaddy,1346141862562828290,thehill,2021-01-04 17:11:39,We need to ban political parties. Adams and Jefferson messed everything up.,0,0,0,need ban political parties adams jefferson messed,"[('Jefferson', 'PERSON')]",0.0,"[101, 2342, 7221, 2576, 4243, 5922, 7625, 18358, 102]"
1346143032429727744,IMrankov,1346141862562828290,thehill,2021-01-04 17:14:43,"Unfortunately, he will get away with it! Like everything else!! Despite your ""totemic constitution"" you keep swearing by every time!! Rich people in America don't go to jail!! Law is for the poor!!",0,0,0,unfortunately away like despite totemic constitution swearing time rich people america dont jail law poor,"[('America', 'GPE'), ('Law', 'PERSON')]",-0.3515625,"[101, 6854, 2185, 2066, 2750, 2000, 18532, 2594, 4552, 25082, 2051, 4138, 2111, 2637, 2123, 2102, 7173, 2375, 3532, 102]"
1346143902517100550,eutrophy121,1346141862562828290,thehill,2021-01-04 17:18:11,Trump is working overtime on his cynicism signaling.,0,0,0,trump working overtime cynicism signaling,"[('Trump', 'ORG')]",0.0,"[101, 8398, 2551, 12253, 22330, 8713, 2964, 14828, 102]"
1346923468282068992,brittaread,1346141862562828290,thehill,2021-01-06 20:55:54,Trump is guilty of treason.,0,0,0,trump guilty treason,"[('Trump', 'ORG')]",-0.5,"[101, 8398, 5905, 14712, 102]"
1346151079868846080,Bbee1960,1346141862562828290,thehill,2021-01-04 17:46:42,Censure is not enough,0,0,0,censure,[],0.0,"[101, 8292, 3619, 5397, 102]"
1346142537749204998,chuck79394571,1346141862562828290,thehill,2021-01-04 17:12:45,"And the USA is supposed to be the anchor of democracy around the world, Trump will create another Vietnam, this time happening in the USA where trump will promote his own form of communism using the military against civilians of the states that will not support him as a dictator",0,0,0,usa supposed anchor democracy world trump create vietnam time happening usa trump promote form communism using military civilians states support dictator,"[('USA', 'GPE'), ('Trump', 'ORG'), ('Vietnam', 'GPE'), ('USA', 'GPE')]",0.25,"[101, 3915, 4011, 8133, 7072, 2088, 8398, 3443, 5148, 2051, 6230, 3915, 8398, 5326, 2433, 15523, 2478, 2510, 9272, 2163, 2490, 21237, 102]"
1346146199926165506,_Serene_96,1346141862562828290,thehill,2021-01-04 17:27:18,"A Georgian censure; An attempt of censoring the attempt of receiving the relevant facts on the table regarding the election. An attempt of bandwagoning in favor of the popular media narrative which entails dismissing all election insecurity claims, resulting in sheepish applause.",0,0,0,georgian censure attempt censoring attempt receiving relevant facts table regarding election attempt bandwagoning favor popular media narrative entails dismissing election insecurity claims resulting sheepish applause,"[('Georgian', 'NORP')]",0.5,"[101, 9166, 8292, 3619, 5397, 3535, 8292, 29577, 2075, 3535, 4909, 7882, 8866, 2795, 4953, 2602, 3535, 2316, 4213, 7446, 2075, 5684, 2759, 2865, 7984, 4372, 22081, 28913, 2602, 16021, 8586, 25137, 4447, 4525, 8351, 4509, 20737, 102]"
1344688181644566528,thehill,1344688181644566528,None,2020-12-31 16:53:40,"President Trump departs West Palm Beach, Florida, for a flight to Washington, D.C.",138,58,93,president trump departs west palm beach florida flight washington dc,"[('Trump', 'PERSON'), ('West Palm Beach', 'GPE'), ('Florida', 'GPE'), ('Washington', 'GPE'), ('D.C.', 'GPE')]",0.0,"[101, 2343, 8398, 18280, 2015, 2225, 5340, 3509, 3516, 3462, 2899, 5887, 102]"
1344688723343020032,victorycharliev,1344688181644566528,thehill,2020-12-31 16:55:49,Crowd is almost as big as his inauguration in 2016,8,1,1,crowd big inauguration 2016,"[('2016', 'DATE')]",0.0,"[101, 4306, 2502, 17331, 2355, 102]"
1344689083486851073,findingsuccess2,1344688181644566528,thehill,2020-12-31 16:57:15,"Maybe not all the people in N. Korea are forced to praise their leader, some might be like these guys",6,0,2,maybe people n korea forced praise leader like guys,"[('N. Korea', 'GPE')]",-0.30000000000000004,"[101, 2672, 2111, 1050, 4420, 3140, 8489, 3003, 2066, 4364, 102]"
1344689797374255104,RonKeating5,1344688181644566528,thehill,2020-12-31 17:00:05,Look... never seen so many uneducated together since Trumps rallies...,2,1,0,look seen uneducated trumps rallies,"[('Trumps', 'PERSON')]",0.5,"[101, 2298, 2464, 16655, 8566, 12921, 8398, 2015, 22867, 102]"
1344690024906895361,rebekahkfreitas,1344688181644566528,thehill,2020-12-31 17:00:59,Awww. Look at his 20 supporters.,3,0,0,awww look 20 supporters,"[('Awww', 'PERSON'), ('20', 'CARDINAL')]",0.0,"[101, 22091, 2860, 2860, 2298, 2322, 6793, 102]"
1344688667961348096,strayhorsedad,1344688181644566528,thehill,2020-12-31 16:55:36,Why is he going back to DC?,2,0,5,going dc,"[('DC', 'GPE')]",0.0,"[101, 2183, 5887, 102]"
1344688775272800257,jerrycannon5,1344688181644566528,thehill,2020-12-31 16:56:01,It's a cult.,2,0,0,cult,[],0.0,"[101, 8754, 102]"
1344705229309292544,PublicPerson4,1344688181644566528,thehill,2020-12-31 18:01:24,Trump is going back to Washington to continue his coup plans. I hope police are ready for this ridiculous quest to overthrow the government. Every in congress & house that rises against the electoral vote counting should be recognized as traitors & expelled.,2,0,0,trump going washington continue coup plans hope police ready ridiculous quest overthrow government congress house rises electoral vote counting recognized traitors expelled,"[('Trump', 'ORG'), ('Washington', 'GPE'), ('congress & house', 'ORG')]",-0.04444444444444443,"[101, 8398, 2183, 2899, 3613, 8648, 3488, 3246, 2610, 3201, 9951, 8795, 16857, 2231, 3519, 2160, 9466, 6092, 3789, 10320, 3858, 17328, 2015, 10016, 102]"
1344688801260646401,ScottLaday,1344688181644566528,thehill,2020-12-31 16:56:07,How much they pay them?,1,0,0,pay,[],0.2,"[101, 3477, 102]"
1344689548605853696,faithoverfear61,1344688181644566528,thehill,2020-12-31 16:59:06,"Could be handcuff time soon, betting it's not Trump being handcuffed.",1,0,1,handcuff time soon betting trump handcuffed,"[('Trump', 'PERSON')]",0.0,"[101, 2192, 10841, 4246, 2051, 2574, 19244, 8398, 2192, 10841, 15388, 102]"
1344689609998020608,emilymerjan1,1344688181644566528,thehill,2020-12-31 16:59:20,How much were they paid to stand out there. #Trumpdeathcult #TraitorsSupportTrump,1,0,0,paid stand trumpdeathcult traitorssupporttrump,"[('Trumpdeathcult', 'PERSON')]",0.2,"[101, 3825, 3233, 8398, 3207, 8988, 10841, 7096, 17328, 4757, 6279, 6442, 24456, 2361, 102]"
1344710750359711746,AneThrope,1344688181644566528,thehill,2020-12-31 18:23:21,And So It Begins... #StopTheCoup,1,0,0,begins stopthecoup,[],0.0,"[101, 4269, 2644, 10760, 3597, 6279, 102]"
1344719023989288968,Cindy63306167,1344688181644566528,thehill,2020-12-31 18:56:13,Teeny weeny sayonara Trump cult.,1,0,0,teeny weeny sayonara trump cult,"[('Teeny', 'ORG'), ('Trump', 'ORG')]",0.0,"[101, 9458, 2100, 16776, 4890, 2360, 7856, 2527, 8398, 8754, 102]"
1341014067146874880,thehill,1341014067146874880,None,2020-12-21 13:34:03,#BREAKING: Robert E. Lee statue removed from US Capitol http://hill.cm/jkwMh74,4800,1100,417,breaking robert e lee statue removed capitol,"[('Robert E. Lee', 'PERSON'), ('US', 'GPE'), ('Capitol', 'ORG')]",0.0,"[101, 4911, 2728, 1041, 3389, 6231, 3718, 9424, 102]"
1341018936746385411,George44716363,1341014067146874880,thehill,2020-12-21 13:53:24,"We didn’t need a statue to remember Hitler. It’s not about erasing history, it’s about how we represent those figures,and proper alignment with the values of America.",204,7,2,didnt need statue remember hitler erasing history represent figuresand proper alignment values america,"[('Hitler', 'PERSON'), ('America', 'GPE')]",0.0,"[101, 2134, 2102, 2342, 6231, 3342, 8042, 28500, 2075, 2381, 5050, 4481, 5685, 5372, 12139, 5300, 2637, 102]"
1341014494999425027,kyle_cullinan,1341014067146874880,thehill,2020-12-21 13:35:45,The MAGA tears will nourish and sustain me for the next 29 days.,67,1,6,maga tears nourish sustain 29 days,"[('MAGA', 'ORG'), ('the next 29 days', 'DATE')]",0.0,"[101, 23848, 2050, 4000, 2053, 9496, 4095, 15770, 2756, 2420, 102]"
