id,speaker_nm,conversation_id,reply_to_nm,timestamp,text,likes,shares,num_comments,cleaned_text,named_entities,sentiment,tokens
1346144931803525120,TRINITYPREZ,1346144570485178368,mboorstein,2021-01-04 17:22:16,"What a total disgrace, completely insulting to the residents of the District of Columbia and so shamefully irresponsible for someone who holds high office....",3,1,0,total disgrace completely insulting residents district columbia shamefully irresponsible holds high office,"[('the District of Columbia', 'GPE')]",-0.27999999999999997,"[101, 2561, 29591, 3294, 23979, 3901, 2212, 3996, 9467, 7699, 20868, 6072, 26029, 19307, 4324, 2152, 2436, 102]"
1346151753322999808,raymondweeden,1346144570485178368,mboorstein,2021-01-04 17:49:22,"I really thought this was an SNL skit, but alas. The Congressmember missed play number one from the DC is dangerous playbook; where is the fake President Bush drug sell and bust?",3,0,0,really thought snl skit alas congressmember missed play number dc dangerous playbook fake president bush drug sell bust,"[('SNL', 'ORG'), ('Congressmember', 'PERSON'), ('one', 'CARDINAL'), ('DC', 'GPE'), ('Bush', 'PERSON')]",-0.325,"[101, 2428, 2245, 1055, 20554, 8301, 2102, 21862, 2015, 3519, 4168, 21784, 4771, 2377, 2193, 5887, 4795, 2377, 8654, 8275, 2343, 5747, 4319, 5271, 13950, 102]"
1346150516833837057,smartindc,1346144570485178368,mboorstein,2021-01-04 17:44:28,She's not even walking through alleys! She's walking through touristy DC! Didn't DC pass no concealed weapons?,2,0,1,shes walking alleys shes walking touristy dc didnt dc pass concealed weapons,[],0.0,"[101, 2016, 2015, 3788, 8975, 2015, 2016, 2015, 3788, 7538, 2100, 5887, 2134, 2102, 5887, 3413, 14091, 4255, 102]"
1346146198332305414,betsyo86740871,1346144570485178368,mboorstein,2021-01-04 17:27:18,"She won’t be allowed into the building, there are metal detectors at every entrance to every US Government building, including Congress and Senate Buildings, Court Houses, etc. this is pure BS. Can’t even get a gun license in DC if you’re not a resident",1,0,0,wont allowed building metal detectors entrance government building including congress senate buildings court houses pure bs gun license dc youre resident,"[('US Government', 'ORG'), ('Congress', 'ORG'), ('Senate Buildings', 'ORG'), ('Court Houses', 'PERSON'), ('DC', 'GPE')]",0.21428571428571427,"[101, 2180, 2102, 3039, 2311, 3384, 25971, 4211, 2231, 2311, 2164, 3519, 4001, 3121, 2457, 3506, 5760, 18667, 3282, 6105, 5887, 2115, 2063, 6319, 102]"
1346344937013428226,DeaconGregK,1346144570485178368,mboorstein,2021-01-05 06:37:01,"If she really wants to stay safe, she should just wear a damn mask.",1,0,0,really wants stay safe just wear damn mask,[],0.35,"[101, 2428, 4122, 2994, 3647, 2074, 4929, 4365, 7308, 102]"
1346146390402072576,betsyo86740871,1346144570485178368,mboorstein,2021-01-04 17:28:04,Full of BS,0,0,0,bs,[],0.35,"[101, 18667, 102]"
1346243905738534914,drussdamonk,1346144570485178368,mboorstein,2021-01-04 23:55:33,Seeing this is the person the district I was born and raised in elected demonstrates toxic unbelief. It frustrates me to no end.,0,0,0,seeing person district born raised elected demonstrates toxic unbelief frustrates end,[],0.0,"[101, 3773, 2711, 2212, 2141, 2992, 2700, 16691, 11704, 4895, 8671, 2666, 2546, 10424, 19966, 20370, 2203, 102]"
1346245344095576064,philafitz,1346144570485178368,mboorstein,2021-01-05 00:01:16,"If she had an ass, I’d hope that she shot herself there.",0,0,0,ass id hope shot,[],0.0,"[101, 4632, 8909, 3246, 2915, 102]"
1346319929809760257,AndrewTheGunn,1346144570485178368,mboorstein,2021-01-05 04:57:39,Welcome to DC. Now go home.,0,0,0,welcome dc home,"[('DC', 'GPE')]",0.8,"[101, 6160, 5887, 2188, 102]"
1346321103606595587,juliaduin,1346144570485178368,mboorstein,2021-01-05 05:02:19,"Plus, isn't that neighborhood protected by Capitol police? No danger there.",0,0,0,plus isnt neighborhood protected capitol police danger,"[('Capitol', 'ORG')]",0.0,"[101, 4606, 3475, 2102, 5101, 5123, 9424, 2610, 5473, 102]"
1346119475968561152,KellieMeyerNews,1346119475968561152,None,2021-01-04 15:41:07,"""Joe Biden won the election in clear and convincing fashion,"" 
@RepJeffries
 says during a news conference on Capitol Hill.",2,0,1,joe biden won election clear convincing fashion repjeffries says news conference capitol hill,"[('Joe Biden', 'PERSON'), ('Capitol Hill', 'ORG')]",0.3,"[101, 3533, 7226, 2368, 2180, 2602, 3154, 13359, 4827, 16360, 6460, 4246, 5134, 2758, 2739, 3034, 9424, 2940, 102]"
1346120621097365509,KellieMeyerNews,1346119475968561152,KellieMeyerNews,2021-01-04 15:45:40,"Jeffries doesn't say if the DOJ should investigate following the Pres. Trump GA SOS call. 

Says their focus is on the pandemic and that Joe Biden will be President on January 20th.",2,0,0,jeffries doesnt say doj investigate following pres trump ga sos says focus pandemic joe biden president january 20th,"[('DOJ', 'ORG'), ('Trump GA SOS', 'PERSON'), ('Joe Biden', 'PERSON'), ('January 20th', 'DATE')]",0.0,"[101, 5076, 5134, 2987, 2102, 2360, 2079, 3501, 8556, 2206, 3653, 2015, 8398, 11721, 2061, 2015, 2758, 3579, 6090, 3207, 7712, 3533, 7226, 2368, 2343, 2254, 3983, 102]"
1346052521052270594,cnni,1346052521052270594,None,2021-01-04 11:15:04,"Astonishing new evidence of a desperate President Trump caught on tape trying to steal the election exposes the depth of his corruption and makes his Republican Capitol Hill allies complicit in his bid to thwart will of voters | Analysis by 
@StCollinson
 https://cnn.it/3pG0ueS",265,107,34,astonishing new evidence desperate president trump caught tape trying steal election exposes depth corruption makes republican capitol hill allies complicit bid thwart voters analysis stcollinson,"[('Trump', 'PERSON'), ('Republican', 'NORP'), ('Capitol Hill', 'ORG'), ('Analysis', 'ORG')]",0.012121212121212125,"[101, 26137, 2047, 3350, 7143, 2343, 8398, 3236, 6823, 2667, 8954, 2602, 14451, 2015, 5995, 7897, 3084, 3951, 9424, 2940, 6956, 4012, 24759, 28775, 2102, 7226, 16215, 18367, 7206, 4106, 2358, 26895, 7076, 2239, 102]"
1346053251179958275,KennethBBoman,1346052521052270594,cnni,2021-01-04 11:17:58,"Caught red handed again in  treason, election tampering and treason.",8,0,1,caught red handed treason election tampering treason,[],0.0,"[101, 3236, 2417, 4375, 14712, 2602, 17214, 4842, 2075, 14712, 102]"
1346055900197515265,JitterCrow,1346052521052270594,cnni,2021-01-04 11:28:29,If Congress does not start impeachment proceedings and if #MikePence does not initiate #25thAmendmentNow then our democracy is worth nothing. #TrumpBrokeTheLaw #LockHimUp,4,1,0,congress does start impeachment proceedings mikepence does initiate 25thamendmentnow democracy worth trumpbrokethelaw lockhimup,"[('Congress', 'ORG'), ('MikePence', 'ORG'), ('25thAmendmentNow', 'MONEY'), ('#TrumpBrokeTheLaw #', 'MONEY'), ('LockHimUp', 'PERSON')]",0.3,"[101, 3519, 2515, 2707, 17727, 5243, 22729, 8931, 3505, 11837, 3401, 2515, 17820, 10965, 27245, 22117, 4765, 19779, 7072, 4276, 8398, 12618, 3489, 10760, 14919, 5843, 14341, 6279, 102]"
1346054282244710401,EthicalDemocrac,1346052521052270594,cnni,2021-01-04 11:22:04,"Agent Orange cannot
Defeat #MyVote",2,0,0,agent orange defeat myvote,"[('MyVote', 'PERSON')]",0.0,"[101, 4005, 4589, 4154, 2026, 22994, 2063, 102]"
1346064482284556290,Favormyke,1346052521052270594,cnni,2021-01-04 12:02:35,No accountability for this criminal will set the stage for another one like him or worse his return.,1,0,0,accountability criminal set stage like worse return,[],-0.4,"[101, 17842, 4735, 2275, 2754, 2066, 4788, 2709, 102]"
1346076814926557184,Stan662949121,1346052521052270594,cnni,2021-01-04 12:51:36,He and his co-conspirators must be arrested! No one is above the law!!,1,0,0,coconspirators arrested law,[],0.0,"[101, 25033, 3619, 8197, 16259, 2015, 4727, 2375, 102]"
1346081750024294401,DrAshSays,1346052521052270594,cnni,2021-01-04 13:11:12,"It’s not astonishing, it’s entirely in character for 
@realDonaldTrump",1,0,0,astonishing entirely character realdonaldtrump,[],-0.125,"[101, 26137, 4498, 2839, 2613, 5280, 19058, 24456, 2361, 102]"
1346054097355608070,braches1,1346052521052270594,cnni,2021-01-04 11:21:19,"PLEASE, STOP THAT I AM SO TIRED OF CNN THAT DONT WACH YOU ANYMORE",0,0,0,stop tired cnn dont wach anymore,"[('CNN', 'ORG')]",-0.4,"[101, 2644, 5458, 13229, 2123, 2102, 11333, 2818, 4902, 102]"
1346055697633595393,john_marine481,1346052521052270594,cnni,2021-01-04 11:27:41,This is a ganister talking!!!,0,0,0,ganister talking,[],0.0,"[101, 25957, 12911, 3331, 102]"
1346060968846123011,mytube1949,1346052521052270594,cnni,2021-01-04 11:48:38,"A game could be named after him.
It'll put Grand Theft Auto in the shade.",0,0,0,game named itll grand theft auto shade,"[('Grand Theft Auto', 'ORG')]",0.04999999999999999,"[101, 2208, 2315, 2009, 3363, 2882, 11933, 8285, 8703, 102]"
1346069948733513777,zinemaniac,1346052521052270594,cnni,2021-01-04 12:24:19,"Fun fact:
The worst crimes that Trump have committed wont get him prosecuted in U.S since Americans don't prosecute their presidents for war crimes.",0,0,0,fun fact worst crimes trump committed wont prosecuted americans dont prosecute presidents war crimes,"[('Trump', 'ORG'), ('U.S', 'GPE'), ('Americans', 'NORP')]",-0.35,"[101, 4569, 2755, 5409, 6997, 8398, 5462, 2180, 2102, 21651, 4841, 2123, 2102, 12388, 26869, 11274, 2162, 6997, 102]"
1346101952468439040,DrMuna34909861,1346052521052270594,cnni,2021-01-04 14:31:29,You can see or hear what you want and brand it whatever you want but that was just a call to his own party official to air his concerns which the whole world knows. Give us a break with your biasness!!!!,0,0,0,hear want brand want just party official air concerns world knows break biasness,[],0.544140625,"[101, 2963, 2215, 4435, 2215, 2074, 2283, 2880, 2250, 5936, 2088, 4282, 3338, 13827, 2791, 102]"
1346132279345573888,Marie10064,1346052521052270594,cnni,2021-01-04 16:31:59,"How could Melania 
@MELANIATRUMP
 have sex with that! ",0,0,0,melania melaniatrump sex,"[('Melania', 'GPE')]",0.0,"[101, 11463, 13241, 11463, 13241, 24456, 2361, 3348, 102]"
1346053031016673280,enochopondo,1346052521052270594,cnni,2021-01-04 11:17:05,"APT COMMENT:
Trump's US, Kim's North Korea, Museveni's Uganda, Putin's Russia, Xi's China and Maduro's Venezuela are in the same undemocratic political class. The US will never again go around the world lecturing everyone on the tenets of democracy.",4,0,0,apt comment trumps kims north korea musevenis uganda putins russia xis china maduros venezuela undemocratic political class world lecturing tenets democracy,"[('APT', 'ORG'), ('Trump', 'PERSON'), ('US', 'GPE'), ('Kim', 'PERSON'), ('North Korea', 'GPE'), ('Museveni', 'GPE'), ('Uganda', 'GPE'), ('Putin', 'PERSON'), ('Russia', 'GPE'), ('Xi', 'PERSON'), ('China', 'GPE'), ('Maduro', 'ORG'), ('Venezuela', 'GPE'), ('US', 'GPE')]",0.19999999999999998,"[101, 26794, 7615, 8398, 2015, 5035, 2015, 2167, 4420, 18437, 8159, 2483, 10031, 22072, 2015, 3607, 8418, 2015, 2859, 5506, 10976, 2015, 8326, 6151, 6633, 10085, 23671, 2576, 2465, 2088, 3393, 19159, 2702, 8454, 7072, 102]"
1346052800409726976,BakeUGreatAgain,1346052521052270594,cnni,2021-01-04 11:16:10,"IMPORTANT!! If you’re planning to go to DC JAN 6 you might want to mention the $2k you just got screwed out of.  oh and bring leftovers!!! Maybe a nice Turkey or Ham sandwich . No recipe attached. If you can’t make a sandwich, give up now ",2,0,0,important youre planning dc jan 6 want mention 2k just got screwed oh bring leftovers maybe nice turkey ham sandwich recipe attached make sandwich,"[('2k', 'MONEY'), ('Turkey', 'GPE')]",0.8,"[101, 2590, 2115, 2063, 4041, 5887, 5553, 1020, 2215, 5254, 1016, 2243, 2074, 2288, 14180, 2821, 3288, 2187, 24302, 2672, 3835, 4977, 10654, 11642, 17974, 4987, 2191, 11642, 102]"
1346088814125731840,CarlosEspirito7,1346052521052270594,cnni,2021-01-04 13:39:17,"Nothing wrong with that call, why you CNN are not investing fraudulent /rigged elections. 
Democrats no peace for what you did. ",0,0,0,wrong cnn investing fraudulent rigged elections democrats peace did,"[('CNN', 'ORG'), ('Democrats', 'NORP')]",-0.5,"[101, 3308, 13229, 19920, 27105, 25216, 3864, 8037, 3521, 2106, 102]"
1346090239408951297,orinoco47,1346052521052270594,cnni,2021-01-04 13:44:56,Well what do you expect of CNN  communist network news,0,0,0,expect cnn communist network news,"[('CNN', 'ORG'), ('communist', 'NORP')]",0.0,"[101, 5987, 13229, 4750, 2897, 2739, 102]"
1346406263689801733,tammycbaggett,1346052521052270594,cnni,2021-01-05 10:40:42,CNN China New Network.,0,0,0,cnn china new network,"[('CNN', 'ORG'), ('China', 'GPE')]",0.13636363636363635,"[101, 13229, 2859, 2047, 2897, 102]"
1346147405687902210,AndrewFeinberg,1346147405687902210,None,2021-01-04 17:32:06,Worth noting that the Capitol Hill streets she is walking down are blocked off to traffic and guarded by Capitol Police checkpoints.,85,13,16,worth noting capitol hill streets walking blocked traffic guarded capitol police checkpoints,"[('Capitol Hill', 'ORG'), ('Capitol Police', 'ORG')]",0.18148148148148147,"[101, 4276, 9073, 9424, 2940, 4534, 3788, 8534, 4026, 13802, 9424, 2610, 26520, 2015, 102]"
1346149154054053889,Rawwwb1,1346147405687902210,AndrewFeinberg,2021-01-04 17:39:03,"I'm trying to picture how silly it would look if Boris Johnson campaigned saying ""I will wear a gun into Parliament""",3,0,0,im trying picture silly look boris johnson campaigned saying wear gun parliament,"[('Boris Johnson', 'PERSON'), ('Parliament', 'ORG')]",-0.5,"[101, 10047, 2667, 3861, 10021, 2298, 11235, 3779, 16196, 3038, 4929, 3282, 3323, 102]"
1346150446616834048,jamesconsidin16,1346147405687902210,AndrewFeinberg,2021-01-04 17:44:11,"So it’s like a charade, wonder where she picked that up from?",3,0,0,like charade wonder picked,[],0.0,"[101, 2066, 25869, 9648, 4687, 3856, 102]"
1346148089715978247,KnockoC,1346147405687902210,AndrewFeinberg,2021-01-04 17:34:49,She seems really smart,2,0,0,really smart,[],0.21428571428571427,"[101, 2428, 6047, 102]"
1346149697510137856,Mark_this,1346147405687902210,AndrewFeinberg,2021-01-04 17:41:12,"In the spirit of the late, great Michael O'Donohue, I hope she's run over by a mammoth truck.",1,0,0,spirit late great michael odonohue hope shes run mammoth truck,"[(""Michael O'Donohue"", 'PERSON')]",0.25,"[101, 4382, 2397, 2307, 2745, 1051, 5280, 11631, 5657, 3246, 2016, 2015, 2448, 23714, 4744, 102]"
1346151260106481668,SarahBigelow5,1346147405687902210,AndrewFeinberg,2021-01-04 17:47:25,Wow.  She's really...something.  Geezus.,1,0,0,wow shes reallysomething geezus,[],0.1,"[101, 10166, 2016, 2015, 2428, 14045, 20744, 20277, 9759, 2015, 102]"
1346165424115875842,Quintus74689745,1346147405687902210,AndrewFeinberg,2021-01-04 18:43:42,"Guns are idols, for a large number of Americans",1,0,0,guns idols large number americans,"[('Americans', 'NORP')]",0.21428571428571427,"[101, 4409, 24438, 2312, 2193, 4841, 102]"
1346156824337248256,rjb926,1346147405687902210,AndrewFeinberg,2021-01-04 18:09:31,If she’s dumb enough not to have that locked while wearing heels...,0,0,0,shes dumb locked wearing heels,[],-0.1875,"[101, 2016, 2015, 12873, 5299, 4147, 8265, 102]"
1346165840484462602,Kline,1346147405687902210,AndrewFeinberg,2021-01-04 18:45:21,Mr. Irving is not going to be pleased.,0,0,0,mr irving going pleased,"[('Irving', 'PERSON')]",0.5,"[101, 2720, 12415, 2183, 7537, 102]"
1346167598682136579,RalphCiinema,1346147405687902210,AndrewFeinberg,2021-01-04 18:52:20,Gun-crazy Americans *shaking head in disbelief*,0,0,0,guncrazy americans shaking head disbelief,"[('Americans', 'NORP')]",0.0,"[101, 3282, 26775, 10936, 2100, 4841, 5513, 2132, 12537, 102]"
1346169120375660545,vgabriele216,1346147405687902210,AndrewFeinberg,2021-01-04 18:58:23,It’s also worth noting she’s an ass,0,0,0,worth noting shes ass,[],0.3,"[101, 4276, 9073, 2016, 2015, 4632, 102]"
1346156058725806081,carlquintanilla,1346156058725806081,None,2021-01-04 18:06:29,"WASHINGTON (AP) — Washington, D.C.‘s mayor urged calm Monday as some 340 National Guard troops were being activated while the city prepared for potentially violent protests surrounding Congress’ expected vote to affirm President-elect Joe Biden’s victory. https://apnews.com/article/joe-biden-donald-trump-politics-electoral-college-muriel-bowser-1634bf71a27de48efef3cd1e6ed4abe4…",194,104,30,washington ap washington dcs mayor urged calm monday 340 national guard troops activated city prepared potentially violent protests surrounding congress expected vote affirm presidentelect joe bidens victory,"[('WASHINGTON', 'GPE'), ('AP', 'ORG'), ('Washington', 'GPE'), ('Monday', 'DATE'), ('National Guard', 'ORG'), ('Congress', 'ORG'), ('Joe Biden’s', 'PERSON')]",-0.19999999999999998,"[101, 2899, 9706, 2899, 5887, 2015, 3664, 9720, 5475, 6928, 16029, 2120, 3457, 3629, 8878, 2103, 4810, 9280, 6355, 8090, 4193, 3519, 3517, 3789, 21358, 27972, 2343, 12260, 6593, 3533, 7226, 6132, 3377, 102]"
1346156858474696704,thehowie,1346156058725806081,carlquintanilla,2021-01-04 18:09:40,The President of the United States is inciting violence and making claims to a naive base that a massive electoral fraud has occurred.  What could go wrong?,12,3,1,president united states inciting violence making claims naive base massive electoral fraud occurred wrong,"[('the United States', 'GPE')]",-0.4,"[101, 2343, 2142, 2163, 4297, 15402, 4808, 2437, 4447, 15743, 2918, 5294, 6092, 9861, 4158, 3308, 102]"
1346156682137755650,NatureConnie,1346156058725806081,carlquintanilla,2021-01-04 18:08:58,"Thank God someone has some brains in Washington and, yes, it’s a woman!",8,0,0,thank god brains washington yes woman,"[('Washington', 'GPE')]",0.0,"[101, 4067, 2643, 14332, 2899, 2748, 2450, 102]"
1346157754738610176,twidark1,1346156058725806081,carlquintanilla,2021-01-04 18:13:13,I am assuming DHS goons with military camo gear without LOE badges and their unmarked vans will be missing in action on Jan 6.,6,0,1,assuming dhs goons military camo gear loe badges unmarked vans missing action jan 6,"[('DHS', 'ORG'), ('LOE', 'ORG'), ('Jan 6', 'DATE')]",-0.06666666666666668,"[101, 10262, 28144, 2015, 27571, 3619, 2510, 11503, 2080, 6718, 8840, 2063, 23433, 25779, 21994, 4394, 2895, 5553, 1020, 102]"
1346156835645087746,mskeviar,1346156058725806081,carlquintanilla,2021-01-04 18:09:34,Like a boss!! Better to be proactive then reactive! Protect my city!! #ProtectDemocracy,4,0,0,like boss better proactive reactive protect city protectdemocracy,"[('ProtectDemocracy', 'PERSON')]",0.9765625,"[101, 2066, 5795, 2488, 4013, 19620, 22643, 4047, 2103, 4047, 3207, 5302, 26775, 15719, 102]"
1346156780510965763,GuyFawk86006293,1346156058725806081,carlquintanilla,2021-01-04 18:09:21,"Oh, where are the cries of ""thugs"" and ""anarchists""? Why is the right so quiet in the face of White Supremacists and Conservative extremists stalking the streets of DC with the intent to cause harm? 
@TuckerCarlson
 @benshapiro
 @FoxNews",2,0,0,oh cries thugs anarchists right quiet face white supremacists conservative extremists stalking streets dc intent cause harm tuckercarlson benshapiro foxnews,"[('White Supremacists', 'ORG'), ('DC', 'GPE'), ('@TuckerCarlson\n @benshapiro\n @FoxNews', 'PERSON')]",0.09523809523809523,"[101, 2821, 12842, 24106, 18448, 2015, 2157, 4251, 2227, 2317, 10514, 28139, 22911, 5130, 4603, 4654, 7913, 23738, 2015, 20070, 4534, 5887, 7848, 3426, 7386, 9802, 10010, 14881, 3841, 7377, 8197, 3217, 4419, 2638, 9333, 102]"
1346170424078585857,CarterG46842078,1346156058725806081,carlquintanilla,2021-01-04 19:03:34,"The plan doesn't work if we STAY HOME!
 We won! Let them fight among themselves.",2,0,0,plan doesnt work stay home won let fight,[],0.0,"[101, 2933, 2987, 2102, 2147, 2994, 2188, 2180, 2292, 2954, 102]"
1346157130399805443,Timeismc2,1346156058725806081,carlquintanilla,2021-01-04 18:10:44,Putin's plan is beginning to come to fruition.,1,0,1,putins plan beginning come fruition,"[('Putin', 'PERSON')]",0.0,"[101, 22072, 2015, 2933, 2927, 2272, 5909, 3258, 102]"
1346169569887596544,LittleLee561,1346156058725806081,carlquintanilla,2021-01-04 19:00:10,Trump has a fit about groups like BLM protecting but has no problem over rightwing protesters.,1,0,0,trump fit groups like blm protecting problem rightwing protesters,"[('Trump', 'ORG'), ('BLM', 'ORG')]",0.4,"[101, 8398, 4906, 2967, 2066, 1038, 13728, 8650, 3291, 2157, 9328, 13337, 102]"
1346186564284592129,baryonic,1346156058725806081,carlquintanilla,2021-01-04 20:07:42,Trump would love an excuse to declare martial law.,1,0,0,trump love excuse declare martial law,"[('Trump', 'ORG')]",0.15,"[101, 8398, 2293, 8016, 13520, 7761, 2375, 102]"
1346157342027632651,alycemichelbri1,1346156058725806081,carlquintanilla,2021-01-04 18:11:35,Call for us to stay home - take away their oxygen and have nothing to do but chant.  Flag makers have never been richer!,0,0,0,stay home away oxygen chant flag makers richer,[],0.0,"[101, 2994, 2188, 2185, 7722, 16883, 5210, 11153, 26108, 102]"
1346141732149325825,CBSEveningNews,1346141732149325825,None,2021-01-04 17:09:33,"Pres. Trump is expected to award Rep. Devin Nunes (R-CA) and Rep. Jim Jordan (R-OH), two of his staunchest allies on Capitol Hill, with the Presidential Medal of Freedom. https://cbsn.ws/2L3edOj",51,75,107,pres trump expected award rep devin nunes rca rep jim jordan roh staunchest allies capitol hill presidential medal freedom,"[('Trump', 'ORG'), ('Devin Nunes', 'PERSON'), ('Jim Jordan', 'PERSON'), ('two', 'CARDINAL'), ('Capitol Hill', 'ORG'), ('the Presidential Medal of Freedom', 'ORG')]",-0.1,"[101, 3653, 2015, 8398, 3517, 2400, 16360, 23601, 16634, 2229, 12639, 16360, 3958, 5207, 20996, 2232, 26355, 4355, 6956, 9424, 2940, 4883, 3101, 4071, 102]"
1346177989508169728,RealMarkEbner,1346141732149325825,CBSEveningNews,2021-01-04 19:33:38,"Gym gets his door prize, and Nunes had a cow.",2,0,0,gym gets door prize nunes cow,"[('Nunes', 'GPE')]",-0.13333333333333333,"[101, 9726, 4152, 2341, 3396, 16634, 2229, 11190, 102]"
1346182757106462722,mckeonmk,1346141732149325825,CBSEveningNews,2021-01-04 19:52:34,"and now the Presidential Medal of Freedom is forever tarnished.  It began with it being bought by Miriam Adelson, and then debased by awarding it to Rush Limbaugh.  Hereafter it will be regarded as having absolutely no credibility and no value.",20,5,1,presidential medal freedom forever tarnished began bought miriam adelson debased awarding rush limbaugh regarded having absolutely credibility value,"[('the Presidential Medal of Freedom', 'ORG'), ('Miriam Adelson', 'PERSON'), ('Rush Limbaugh', 'PERSON')]",-0.1,"[101, 4883, 3101, 4071, 5091, 16985, 28357, 2211, 4149, 16925, 4748, 9050, 2239, 2139, 15058, 2094, 21467, 5481, 15291, 4887, 5603, 5240, 2383, 7078, 21553, 3643, 102]"
1346143851002671104,LAKBOSTON,1346141732149325825,CBSEveningNews,2021-01-04 17:17:58,What a sad ceremony that will be.,10,0,0,sad ceremony,[],-0.5,"[101, 6517, 5103, 102]"
1346186200206479364,Yvonne81331203,1346141732149325825,CBSEveningNews,2021-01-04 20:06:15,"Call it what it is ....
"" Trumpy A$$ Kisser Award """,6,0,0,trumpy kisser award,"[('Kisser Award', 'PERSON')]",0.0,"[101, 8398, 2100, 3610, 2121, 2400, 102]"
1346212636812308492,BlasineA,1346141732149325825,CBSEveningNews,2021-01-04 21:51:18,"Ok, time to retire the name Medal of Freedom.",6,0,0,ok time retire medal freedom,"[('Medal of Freedom', 'ORG')]",0.5,"[101, 7929, 2051, 11036, 3101, 4071, 102]"
1346166744042258433,Janet87316815,1346141732149325825,CBSEveningNews,2021-01-04 18:48:57,No!  What did either of these individuals do to earn such a prestigious honor.  Absolutely nothing!,5,0,0,did individuals earn prestigious honor absolutely,[],0.125,"[101, 2106, 3633, 7796, 8919, 3932, 7078, 102]"
1346172023861514240,PecosMike,1346141732149325825,CBSEveningNews,2021-01-04 19:09:55,The ONE person who deserves the Medal of Freedom is Brad Raffensperger!,5,0,0,person deserves medal freedom brad raffensperger,"[('ONE', 'CARDINAL'), ('the Medal of Freedom', 'WORK_OF_ART')]",0.0,"[101, 2711, 17210, 3101, 4071, 8226, 7148, 18940, 17668, 4590, 102]"
1346234221405339648,KathleenMcCarr8,1346141732149325825,CBSEveningNews,2021-01-04 23:17:04,"This makes the Presidential Medal of Freedom null and void.  It might as well be made out of pop beads and a 
medallion from a gum ball machine.
#SeditiousGOP 
#GOPComplicitTraitors 
#RuleOfLaw",5,0,1,makes presidential medal freedom null void pop beads medallion gum ball machine seditiousgop gopcomplicittraitors ruleoflaw,"[('the Presidential Medal of Freedom', 'WORK_OF_ART'), ('#', 'CARDINAL'), ('RuleOfLaw', 'PERSON')]",0.0,"[101, 3084, 4883, 3101, 4071, 19701, 11675, 3769, 17530, 22541, 16031, 3608, 3698, 7367, 23194, 6313, 3995, 2361, 2175, 15042, 25377, 10415, 12474, 14995, 6591, 3627, 11253, 14919, 102]"
1346179073211592704,oldhomedot,1346141732149325825,CBSEveningNews,2021-01-04 19:37:56,Two cons attached to the crime boss. Integrity hahahahaha!!,4,0,0,cons attached crime boss integrity hahahahaha,"[('Two', 'CARDINAL')]",0.3125,"[101, 9530, 2015, 4987, 4126, 5795, 11109, 5292, 3270, 3270, 3270, 3270, 102]"
1346182186068811776,SouthernWitch63,1346141732149325825,CBSEveningNews,2021-01-04 19:50:18,The medal of freedom has no meaning anymore. It's like getting one of those medals in school for just participating,4,1,1,medal freedom meaning anymore like getting medals school just participating,[],0.0,"[101, 3101, 4071, 3574, 4902, 2066, 2893, 6665, 2082, 2074, 8019, 102]"
1346178430279294979,rkelser3200,1346141732149325825,CBSEveningNews,2021-01-04 19:35:23,This train is so far off the track right now. 1/20 can’t get here quick enough.,2,0,0,train far track right 120 quick,"[('1/20', 'CARDINAL')]",0.17976190476190473,"[101, 3345, 2521, 2650, 2157, 6036, 4248, 102]"
