id,speaker_nm,conversation_id,reply_to_nm,timestamp,text,likes,shares,num_comments,cleaned_text,named_entities,sentiment,tokens
1339230232088367105,MrAndyNgo,1339230232088367105,None,2020-12-16 15:25:43,"BLM-antifa in Seattle have set up another autonomous zone at Cal Anderson Park in the Capital Hill neighborhood. This is the same area they made CHAZ during the summer months. Video by 
@choeshow
:",5200,2700,1400,blmantifa seattle set autonomous zone cal anderson park capital hill neighborhood area chaz summer months video choeshow,"[('BLM-antifa', 'ORG'), ('Seattle', 'GPE'), ('Cal Anderson Park', 'FAC'), ('Capital Hill', 'LOC'), ('the summer months', 'DATE')]",0.2,"[101, 1038, 12624, 3775, 7011, 5862, 2275, 8392, 4224, 10250, 5143, 2380, 3007, 2940, 5101, 2181, 15775, 2480, 2621, 2706, 2678, 16480, 9953, 5004, 102]"
1339230948488073219,Freakoutery,1339230232088367105,MrAndyNgo,2020-12-16 15:28:34,"At some point it seems as if we could just start tweeting out videos of landfills and Haitian ghettos and say ""another autonomous zone has erupted in ___"" and they'd be totally believable.",113,2,1,point just start tweeting videos landfills haitian ghettos say autonomous zone erupted theyd totally believable,"[('Haitian', 'NORP')]",0.45,"[101, 2391, 2074, 2707, 1056, 28394, 3436, 6876, 28382, 2015, 21404, 17276, 2015, 2360, 8392, 4224, 12591, 2027, 2094, 6135, 19337, 2666, 12423, 102]"
1339451172659322882,DevinCow,1339230232088367105,MrAndyNgo,2020-12-17 06:03:40,"Hay 
@KathrynTewson
 they’re lying again",13,0,1,hay kathryntewson theyre lying,[],0.0,"[101, 10974, 20484, 2618, 9333, 2239, 2027, 2890, 4688, 102]"
1339236439620349957,palindromemood,1339230232088367105,MrAndyNgo,2020-12-16 15:50:23,"This is what we have to look forward to in the Harris/Biden administration. By the time the sympathizers wake up, it’ll be too late.",87,5,2,look forward harrisbiden administration time sympathizers wake itll late,"[('Biden', 'PERSON')]",-0.3,"[101, 2298, 2830, 5671, 17062, 2368, 3447, 2051, 25353, 8737, 25457, 16750, 5256, 2009, 3363, 2397, 102]"
1339231536642629632,kmcannistraci,1339230232088367105,MrAndyNgo,2020-12-16 15:30:54,1 time my kid put a note on the door”don’t come in”. I took the door off for a year. That what you do when children throw tantrums. Also you would think with all those collective people together they could come up with a system to clean that place up. Come on man!,74,3,10,1 time kid note doordont come took door year children throw tantrums think collective people come clean place come man,"[('1', 'CARDINAL'), ('a year', 'DATE')]",0.45833333333333337,"[101, 1015, 2051, 4845, 3602, 2341, 5280, 2102, 2272, 2165, 2341, 2095, 2336, 5466, 9092, 24456, 2015, 2228, 7268, 2111, 2272, 4550, 2173, 2272, 2158, 102]"
1339231959927631873,skol_brian,1339230232088367105,MrAndyNgo,2020-12-16 15:32:35,Andy cuts the video and calls it a CHAZ when it's a homeless encampment.  Not surprising. Gotta get those Ngo Simps fird up right?,50,1,34,andy cuts video calls chaz homeless encampment surprising gotta ngo simps fird right,"[('Andy', 'PERSON'), ('Ngo Simps', 'GPE')]",-0.03214285714285714,"[101, 5557, 7659, 2678, 4455, 15775, 2480, 11573, 4372, 26468, 3672, 11341, 10657, 17895, 21934, 4523, 21554, 2094, 2157, 102]"
1339234000162844674,St3veOlson,1339230232088367105,MrAndyNgo,2020-12-16 15:40:42,"I totally support this. As long as we get to build an additional wall around them and never let them come out. Once their supplies diminish, it would only be a matter of time before the problem would resolve itself.",14,0,1,totally support long build additional wall let come supplies diminish matter time problem resolve,[],-0.016666666666666666,"[101, 6135, 2490, 2146, 3857, 3176, 2813, 2292, 2272, 6067, 11737, 5498, 4095, 3043, 2051, 3291, 10663, 102]"
1339313377177460743,ShraderKs,1339230232088367105,MrAndyNgo,2020-12-16 20:56:07,Wait antifa is a myth! BLM is a multi-billion dollar organization they wouldn't live like this!! Would they? This is what the left has given birth too. How in the world did 81 million people vote for this?,10,1,8,wait antifa myth blm multibillion dollar organization wouldnt live like left given birth world did 81 million people vote,"[('BLM', 'ORG'), ('multi-billion dollar', 'MONEY'), ('81 million', 'CARDINAL')]",0.1065340909090909,"[101, 3524, 3424, 7011, 10661, 1038, 13728, 4800, 24457, 3258, 7922, 3029, 2876, 2102, 2444, 2066, 2187, 2445, 4182, 2088, 2106, 6282, 2454, 2111, 3789, 102]"
1339231336867966980,wilconorth_j,1339230232088367105,MrAndyNgo,2020-12-16 15:30:07,It’s really wonderful what they’ve been able to build,9,0,1,really wonderful theyve able build,[],0.75,"[101, 2428, 6919, 2027, 3726, 2583, 3857, 102]"
1339342589951176718,Designsage,1339230232088367105,MrAndyNgo,2020-12-16 22:52:11,"Wow, Seattle is starting to look like a third world country. WOW.",5,1,1,wow seattle starting look like world country wow,"[('Seattle', 'GPE'), ('WOW', 'ORG')]",0.05,"[101, 10166, 5862, 3225, 2298, 2066, 2088, 2406, 10166, 102]"
1339345626119671809,OlCurt66,1339230232088367105,MrAndyNgo,2020-12-16 23:04:15,"I’ve said it before and will again. I have no more sympathy for the folks living there. If they won’t band together to stop this, so be it.",7,0,3,ive said sympathy folks living wont band stop,[],-0.25,"[101, 4921, 2063, 2056, 11883, 12455, 2542, 2180, 2102, 2316, 2644, 102]"
1339232994905743360,EdwinHoward1144,1339230232088367105,MrAndyNgo,2020-12-16 15:36:42,"Keep the faith, Trump’s hellfire is about to rain down on the anarcho-communists and the deep state.",4,1,2,faith trumps hellfire rain anarchocommunists deep state,"[('Trump', 'ORG')]",-0.07777777777777779,"[101, 4752, 8398, 2015, 3109, 10273, 4542, 9617, 11140, 24163, 7382, 19496, 12837, 2784, 2110, 102]"
1337813537482223618,thehill,1337813537482223618,None,2020-12-12 17:36:17,"WATCH: Trump supporters gather in Washington, D.C. on Saturday.",589,302,441,watch trump supporters gather washington dc saturday,"[('Washington', 'GPE'), ('D.C.', 'GPE'), ('Saturday', 'DATE')]",0.0,"[101, 3422, 8398, 6793, 8587, 2899, 5887, 5095, 102]"
1337814925301919744,wireframejames,1337813537482223618,thehill,2020-12-12 17:41:48,Imagine if women turned out in support of Trump? It might look like this.,30,6,0,imagine women turned support trump look like,"[('Trump', 'ORG')]",0.0,"[101, 5674, 2308, 2357, 2490, 8398, 2298, 2066, 102]"
1337813689378861056,chin_dogg,1337813537482223618,thehill,2020-12-12 17:36:53,Is this Egypt? Cause that looks like a river of denial,48,0,6,egypt cause looks like river denial,"[('Egypt', 'GPE')]",0.0,"[101, 5279, 3426, 3504, 2066, 2314, 14920, 102]"
1337818431907880961,JGaffneyUSN,1337813537482223618,thehill,2020-12-12 17:55:44,How did they scrape up the gas money?,25,1,0,did scrape gas money,[],0.0,"[101, 2106, 26988, 3806, 2769, 102]"
1337813722144837632,ElyseBurden,1337813537482223618,thehill,2020-12-12 17:37:01,Who cares what they do,26,0,1,cares,[],0.0,"[101, 14977, 102]"
1337815027437473794,BeingJWood,1337813537482223618,thehill,2020-12-12 17:42:12,Maybe more of them should have voted in the election. It’s tough to carry a candidate with approval in the low 40’s over the finish line.,12,1,2,maybe voted election tough carry candidate approval low 40s finish line,"[('40', 'CARDINAL')]",0.037037037037037035,"[101, 2672, 5444, 2602, 7823, 4287, 4018, 6226, 2659, 2871, 2015, 3926, 2240, 102]"
1337814119072886784,ezautoleasesale,1337813537482223618,thehill,2020-12-12 17:38:36,"If Trump was the patriot he claims to be, he would quash this foolishness, admit he has lost fair and square, concede the election and tell his sycophants to go home.   Election is over, but oh now....he cant do that.",12,0,5,trump patriot claims quash foolishness admit lost fair square concede election tell sycophants home election oh nowhe,"[('Trump', 'PERSON')]",0.7,"[101, 8398, 16419, 4447, 24209, 11823, 13219, 2791, 6449, 2439, 4189, 2675, 9530, 22119, 2602, 2425, 25353, 3597, 21890, 7666, 2188, 2602, 2821, 2085, 5369, 102]"
1337814154921431040,PaulStaebell,1337813537482223618,thehill,2020-12-12 17:38:44,WOW That crowd is almost as big as his Inaugeration,12,0,0,wow crowd big inaugeration,"[('WOW', 'ORG'), ('Inaugeration', 'FAC')]",0.05,"[101, 10166, 4306, 2502, 27118, 22890, 8156, 102]"
1337816652361199618,DrJones03046447,1337813537482223618,thehill,2020-12-12 17:48:40,How come he had 71 million votes and can only get a crowd of around a thousand like this in Washington? Something fishy - this shows the true cult of Trump ... which really is pretty small!,8,2,0,come 71 million votes crowd thousand like washington fishy shows true cult trump really pretty small,"[('71 million', 'CARDINAL'), ('around a thousand', 'CARDINAL'), ('Washington', 'GPE'), ('Trump', 'ORG')]",0.071875,"[101, 2272, 6390, 2454, 4494, 4306, 4595, 2066, 2899, 3869, 2100, 3065, 2995, 8754, 8398, 2428, 3492, 2235, 102]"
1337813634639155201,GodSavesToday,1337813537482223618,thehill,2020-12-12 17:36:40,"Am I the only one hoping to watch the Secret Service carry that Orange Clown out on January 20th? 
#ITSOVER",10,0,2,hoping watch secret service carry orange clown january 20th itsover,"[('the Secret Service', 'ORG'), ('Orange Clown', 'LOC'), ('January 20th', 'DATE'), ('ITSOVER', 'PERSON')]",-0.13333333333333333,"[101, 5327, 3422, 3595, 2326, 4287, 4589, 15912, 2254, 3983, 2049, 7840, 102]"
1345179662880624641,choeshow,1345179662880624641,None,2021-01-02 01:26:38,"NEW YEAR’S EVE DESTRUCTION: Capitol Hill biz owners and neighbors are fed up with black bloc marchers wrecking the city. The owner of Cafe Argento says they’re being targeted for just trying to improve the neighborhood.

Story 6pm 
@komonews
 

#seattle #CalAndersonPark",271,112,56,new years eve destruction capitol hill biz owners neighbors fed black bloc marchers wrecking city owner cafe argento says theyre targeted just trying improve neighborhood story 6pm komonews seattle calandersonpark,"[('Capitol Hill', 'ORG'), ('Cafe Argento', 'ORG'), ('6pm', 'TIME'), ('#', 'CARDINAL')]",-0.015151515151515152,"[101, 2047, 2086, 6574, 6215, 9424, 2940, 12170, 2480, 5608, 10638, 7349, 2304, 15984, 28791, 2869, 12006, 2075, 2103, 3954, 7668, 23157, 2080, 2758, 2027, 2890, 9416, 2074, 2667, 5335, 5101, 2466, 1020, 9737, 12849, 8202, 7974, 2015, 5862, 10250, 12243, 3385, 14432, 102]"
1345186143931797505,flottum76lynn,1345179662880624641,choeshow,2021-01-02 01:52:23,"Well, when you catch and release these idiots night after night, this is what happens. Maybe try voting next time for a candidate without a “D” next to their name. This will never end.",68,3,4,catch release idiots night night happens maybe try voting time candidate d end,"[('night', 'TIME')]",-0.26666666666666666,"[101, 4608, 2713, 28781, 2305, 2305, 6433, 2672, 3046, 6830, 2051, 4018, 1040, 2203, 102]"
1345182726584844290,integrityiseve1,1345179662880624641,choeshow,2021-01-02 01:38:48,Why bother trying to improve the neighborhood. Open in a place that will appreciate your efforts,43,0,1,bother trying improve neighborhood open place appreciate efforts,[],0.0,"[101, 8572, 2667, 5335, 5101, 2330, 2173, 9120, 4073, 102]"
1345180938653732870,ScreamingInSea,1345179662880624641,choeshow,2021-01-02 01:31:42,"Smashing up another LGBT POC owned small business. 

It feels like the gay bars/clubs/even coffee shops are targeted more then anyone else. 
Look what happened to QueerBar & Neighbors.",14,0,2,smashing lgbt poc owned small business feels like gay barsclubseven coffee shops targeted look happened queerbar neighbors,"[('LGBT POC', 'ORG'), ('QueerBar & Neighbors', 'ORG')]",0.22222222222222224,"[101, 21105, 12010, 13433, 2278, 3079, 2235, 2449, 5683, 2066, 5637, 6963, 20464, 12083, 3366, 8159, 4157, 7340, 9416, 2298, 3047, 19483, 8237, 10638, 102]"
1345181731200983041,RBtw33ts,1345179662880624641,choeshow,2021-01-02 01:34:51,It is never ok to destroy someone else’s property.  If you do not like a business don’t go there.,9,0,0,ok destroy elses property like business dont,[],-0.225,"[101, 7929, 6033, 2842, 2015, 3200, 2066, 2449, 2123, 2102, 102]"
1345195592004194305,Chrismorama,1345179662880624641,choeshow,2021-01-02 02:29:56,The coming backlash will be severe.,9,0,1,coming backlash severe,[],0.0,"[101, 2746, 25748, 5729, 102]"
1345235076913782784,cwgrl42632,1345179662880624641,choeshow,2021-01-02 05:06:50,You should ask all these fed up residents and business owners who they have been voting for over the last 10-15 years....,9,0,1,ask fed residents business owners voting 1015 years,"[('the last', 'DATE'), ('10-15 years', 'DATE')]",0.0,"[101, 3198, 7349, 3901, 2449, 5608, 6830, 7886, 2629, 2086, 102]"
1345211225475571713,LoneStarWhiz,1345179662880624641,choeshow,2021-01-02 03:32:03,You voted them into power.,4,0,0,voted power,[],0.0,"[101, 5444, 2373, 102]"
1345185595891404800,mchellshit,1345179662880624641,choeshow,2021-01-02 01:50:13,"Congrats, Jeff Bezos is now that much richer.",3,0,0,congrats jeff bezos richer,"[('Congrats', 'NORP'), ('Jeff Bezos', 'PERSON')]",0.2,"[101, 26478, 8609, 2015, 5076, 2022, 28370, 26108, 102]"
1345401572898050050,lynstar_16,1345179662880624641,choeshow,2021-01-02 16:08:25,These people are so destructive. If they could only put their energy into something positive and constructive.,3,0,0,people destructive energy positive constructive,[],-0.12424242424242422,"[101, 2111, 15615, 2943, 3893, 26157, 102]"
1345182925621317639,TheDigriz,1345179662880624641,choeshow,2021-01-02 01:39:36,Time for him to buy a gun.,2,0,0,time buy gun,[],0.0,"[101, 2051, 4965, 3282, 102]"
1345201642224943105,MikeHalston2,1345179662880624641,choeshow,2021-01-02 02:53:58,"Too bad.
Why don't they ask their stupid fellow citizens to stop voting for far-left appeasers of this cancerous ideology?
And if their fellow citizens aren't interested in safety, amenity, economic prosperity etc. then get the hell out of these rotten far-left hellholes!",1,0,0,bad dont ask stupid fellow citizens stop voting farleft appeasers cancerous ideology fellow citizens arent interested safety amenity economic prosperity hell rotten farleft hellholes,[],-0.24999999999999994,"[101, 2919, 2123, 2102, 3198, 5236, 3507, 4480, 2644, 6830, 2521, 2571, 6199, 10439, 19500, 2869, 4456, 3560, 13165, 3507, 4480, 4995, 2102, 4699, 3808, 2572, 20693, 3171, 14165, 3109, 11083, 2521, 2571, 6199, 3109, 19990, 102]"
1339624669750681600,MayorBowser,1339624669750681600,None,2020-12-17 17:33:04,"Today, our frontline workers received their first dose of the COVID-19 vaccine at Kaiser Permanente in Capitol Hill. These vaccinations will save lives & protect our first responders, their patients, and their families. 

There is reason to have hope. 

#GetVaccinatedDC, #DCHOPE",154,38,10,today frontline workers received dose covid19 vaccine kaiser permanente capitol hill vaccinations save lives protect responders patients families reason hope getvaccinateddc dchope,"[('Today', 'DATE'), ('first', 'ORDINAL'), ('COVID-19', 'ORG'), ('Kaiser Permanente', 'FAC'), ('Capitol Hill', 'ORG'), ('first', 'ORDINAL'), ('DCHOPE', 'PERSON')]",0.25,"[101, 2651, 2392, 4179, 3667, 2363, 13004, 2522, 17258, 16147, 17404, 15676, 4568, 2063, 9424, 2940, 12436, 14693, 9323, 2015, 3828, 3268, 4047, 6869, 2545, 5022, 2945, 3114, 3246, 2131, 24887, 28748, 3064, 16409, 5887, 26441, 102]"
1341245162442375168,ShorePoint888,1339624669750681600,MayorBowser,2020-12-22 04:52:20,"Why is the Director of Health, Dr. LaQuandra Nesbitt, always so  unhappy?",1,0,0,director health dr laquandra nesbitt unhappy,"[('LaQuandra Nesbitt', 'PERSON')]",-0.6,"[101, 2472, 2740, 2852, 2474, 16211, 17670, 24524, 16313, 2102, 12511, 102]"
1339677807740383234,2DeCee,1339624669750681600,MayorBowser,2020-12-17 21:04:14,Thank you for the update Madam Mayor,0,0,1,thank update madam mayor,"[('Madam', 'PERSON')]",0.0,"[101, 4067, 10651, 21658, 3664, 102]"
1346148068773789697,CBSEveningNews,1346148068773789697,None,2021-01-04 17:34:44,"At least a dozen GOP senators are vowing to challenge President-elect Joe Biden’s election victory on Wednesday.

Some have cited baseless conspiracy theories about the election as disputes over the results split the Republican party on Capitol Hill.",4,6,6,dozen gop senators vowing challenge presidentelect joe bidens election victory wednesday cited baseless conspiracy theories election disputes results split republican party capitol hill,"[('At least a dozen', 'CARDINAL'), ('GOP', 'ORG'), ('Joe Biden’s', 'PERSON'), ('Wednesday', 'DATE'), ('the Republican party', 'ORG'), ('Capitol Hill', 'ORG')]",-0.3,"[101, 6474, 2175, 2361, 10153, 19076, 2075, 4119, 2343, 12260, 6593, 3533, 7226, 6132, 2602, 3377, 9317, 6563, 14040, 7971, 9714, 8106, 2602, 11936, 3463, 3975, 3951, 2283, 9424, 2940, 102]"
1346148970440118274,airwest007,1346148068773789697,CBSEveningNews,2021-01-04 17:38:19,cBSnews  M$M,1,0,0,cbsnews mm,[],0.0,"[101, 6568, 2638, 9333, 3461, 102]"
1346183164989992960,tompach09234046,1346148068773789697,CBSEveningNews,2021-01-04 19:54:12,Is this the seditious twelve ,1,0,0,seditious,"[('twelve', 'CARDINAL')]",0.0,"[101, 7367, 23194, 6313, 102]"
1346150649780719617,CapsHockey1974,1346148068773789697,CBSEveningNews,2021-01-04 17:44:59,"They know that it won’t go anywhere, but their objections are going to be rejected by the Senate when it comes to a vote. It’s about their future political ambitions.",0,0,0,know wont objections going rejected senate comes vote future political ambitions,"[('Senate', 'ORG')]",0.0,"[101, 2113, 2180, 2102, 17304, 2183, 5837, 4001, 3310, 3789, 2925, 2576, 19509, 102]"
1346153959619231746,choytdad,1346148068773789697,CBSEveningNews,2021-01-04 17:58:08,"Why describe it as “baseless conspiracy theories” when there is video evidence showing suitcases of ballots being drawn under a covered table after the Republican poll watchers were told to go home.
These tens of thousands of ballots were then processed between 10.35 pm and1.00am",0,0,0,baseless conspiracy theories video evidence showing suitcases ballots drawn covered table republican poll watchers told home tens thousands ballots processed 1035 pm and100am,"[('Republican', 'NORP'), ('These tens of thousands', 'CARDINAL'), ('10.35 pm', 'TIME')]",0.0,"[101, 14040, 7971, 9714, 8106, 2678, 3350, 4760, 15940, 2015, 17069, 4567, 3139, 2795, 3951, 8554, 3422, 2545, 2409, 2188, 15295, 5190, 17069, 13995, 9800, 2629, 7610, 1998, 18613, 3286, 102]"
1335507416331390976,KatieDaviscourt,1335507416331390976,None,2020-12-06 08:52:35,"OLYMPIA, WA: Shots were fired earlier today outside of the Washington State Capitol during a clash between Antifa Militants and Patriots. The Olympia Police Department has the man in custody and is investigating.

*Warning*—Video Via BL Ranch on YT",211,84,27,olympia wa shots fired earlier today outside washington state capitol clash antifa militants patriots olympia police department man custody investigating warningvideo bl ranch yt,"[('earlier today', 'TIME'), ('Washington State', 'GPE'), ('Capitol', 'ORG'), ('Antifa Militants', 'ORG'), ('Patriots', 'ORG'), ('The Olympia Police Department', 'ORG'), ('YT', 'GPE')]",0.0,"[101, 17096, 11333, 7171, 5045, 3041, 2651, 2648, 2899, 2110, 9424, 13249, 3424, 7011, 17671, 11579, 17096, 2610, 2533, 2158, 9968, 11538, 5432, 17258, 8780, 1038, 2140, 8086, 1061, 2102, 102]"
1335507418411745283,KatieDaviscourt,1335507416331390976,KatieDaviscourt,2020-12-06 08:52:35,"Statement from 
@OlyPD
:",34,7,4,statement olypd,[],0.0,"[101, 4861, 19330, 22571, 2094, 102]"
1338299732918063105,GunWashington,1335507416331390976,KatieDaviscourt,2020-12-14 01:48:15,"If anyone actually saw this incident in Olympia this weekend, please contact Washington Gun Law today at 425.765.0487 immediately.",0,0,0,actually saw incident olympia weekend contact washington gun law today 4257650487 immediately,"[('Olympia', 'GPE'), ('this weekend', 'DATE'), ('Washington Gun Law', 'WORK_OF_ART'), ('today', 'DATE')]",0.0,"[101, 2941, 2387, 5043, 17096, 5353, 3967, 2899, 3282, 2375, 2651, 23285, 2581, 26187, 2692, 18139, 2581, 3202, 102]"
1335749559448973316,ColleenAnderso2,1335507416331390976,KatieDaviscourt,2020-12-07 00:54:46,https://facebook.com/112779115408517/posts/4108502765836112/?d=n…. It was trump follower who was arrested. So much for “law and order”.,7,0,3,trump follower arrested law order,[],0.2,"[101, 8398, 22399, 4727, 2375, 2344, 102]"
1335564467149524992,WRB_BOB,1335507416331390976,KatieDaviscourt,2020-12-06 12:39:17,Looks like the guy in the bright yellow was defending him self this video I hope help him,5,0,2,looks like guy bright yellow defending self video hope help,[],0.35000000000000003,"[101, 3504, 2066, 3124, 4408, 3756, 6984, 2969, 2678, 3246, 2393, 102]"
1335598262099746818,Hydro_Sparky,1335507416331390976,KatieDaviscourt,2020-12-06 14:53:34,"Oly PD doing the typical, ignore attacks by the violent left and arrest their victims who defend themselves, routine.

I refuse to believe this is the will of the people. We need voter ID reform so elected officials have to care about the average citizen again",5,0,1,oly pd doing typical ignore attacks violent left arrest victims defend routine refuse believe people need voter id reform elected officials care average citizen,"[('Oly PD', 'ORG')]",-0.2333333333333333,"[101, 19330, 2100, 22851, 2725, 5171, 8568, 4491, 6355, 2187, 6545, 5694, 6985, 9410, 10214, 2903, 2111, 2342, 14303, 8909, 5290, 2700, 4584, 2729, 2779, 6926, 102]"
1337930542348718083,MegMadison13,1335507416331390976,KatieDaviscourt,2020-12-13 01:21:13,There is no such thing as an Antifa militant! Do you actually know what Antifa means??? Idiot!,3,0,0,thing antifa militant actually know antifa means idiot,"[('Antifa', 'NORP'), ('Antifa', 'ORG'), ('Idiot', 'PERSON')]",-0.3333333333333333,"[101, 2518, 3424, 7011, 16830, 2941, 2113, 3424, 7011, 2965, 10041, 102]"
1336086725458726912,AmazonFortress,1335507416331390976,KatieDaviscourt,2020-12-07 23:14:33,Antifa would always show up to Patriots peaceful rallies to start trouble.,1,0,0,antifa patriots peaceful rallies start trouble,"[('Antifa', 'ORG'), ('Patriots', 'ORG')]",0.024999999999999994,"[101, 3424, 7011, 11579, 9379, 22867, 2707, 4390, 102]"
1337923429308100608,hummingbirddab,1335507416331390976,KatieDaviscourt,2020-12-13 00:52:57,Just say trump supporter shot multiple times at anti trump supporters..and was hogtied and carried off. Hope he rots!!,1,0,0,just say trump supporter shot multiple times anti trump supportersand hogtied carried hope rots,[],0.0,"[101, 2074, 2360, 8398, 10129, 2915, 3674, 2335, 3424, 8398, 6793, 5685, 27589, 9515, 2094, 3344, 3246, 18672, 2015, 102]"
1337929123918979074,KevinKennedy002,1335507416331390976,KatieDaviscourt,2020-12-13 01:15:35,Stop those criminal white supremacy gangs. Those proud boys need to stop their violence.,1,0,0,stop criminal white supremacy gangs proud boys need stop violence,[],0.13333333333333333,"[101, 2644, 4735, 2317, 22006, 18542, 7098, 3337, 2342, 2644, 4808, 102]"
1337929493420380161,phoenixmacleod1,1335507416331390976,KatieDaviscourt,2020-12-13 01:17:03,lol you aren’t a reporter. You are a joke. The labels you have chosen show that you aren’t a real reporter.,1,0,0,lol arent reporter joke labels chosen arent real reporter,[],0.5,"[101, 8840, 2140, 4995, 2102, 6398, 8257, 10873, 4217, 4995, 2102, 2613, 6398, 102]"
1346193314727518211,MonoNeon,1346193314727518211,None,2021-01-04 20:34:31,"NEW ALBUM OUT NOW
“Banana Peel On Capitol Hill”
LINK: https://dywanethomasjr.bandcamp.com/album/banana-peel-on-capitol-hill…

“Yesterday the world was buried alive”

Stanks ya for listening to whateva the fyuck I be doing... ",22,8,0,new album banana peel capitol hill link yesterday world buried alive stanks ya listening whateva fyuck doing,"[('Banana Peel On Capitol Hill', 'WORK_OF_ART'), ('Yesterday', 'DATE')]",0.11818181818181818,"[101, 2047, 2201, 15212, 14113, 9424, 2940, 4957, 7483, 2088, 3950, 4142, 9761, 5705, 8038, 5962, 2054, 13331, 1042, 10513, 3600, 2725, 102]"
1337770272963825665,FordFischer,1337770272963825665,None,2020-12-12 14:44:22,"Worth noting that because there’s a few separate rally points (I misspelled this as “tally” in my first tweet of this thread, sorry) some people are already marching east toward the Capitol / rally point on national mall from Freedom Plaza.",119,18,8,worth noting theres separate rally points misspelled tally tweet thread sorry people marching east capitol rally point national mall freedom plaza,"[('first', 'ORDINAL'), ('Capitol', 'ORG'), ('Freedom Plaza', 'LOC')]",-0.037500000000000006,"[101, 4276, 9073, 2045, 2015, 3584, 8320, 2685, 3335, 11880, 3709, 19552, 1056, 28394, 2102, 11689, 3374, 2111, 10998, 2264, 9424, 8320, 2391, 2120, 6670, 4071, 8232, 102]"
1337769536674820101,FordFischer,1337770272963825665,FordFischer,2020-12-12 14:41:26,"The “Trump Unity Bridge” is parked right now and playing “God Bless America” at 11th and Penn, between Harry’s Bar and the Trump hotel.",98,31,13,trump unity bridge parked right playing god bless america 11th penn harrys bar trump hotel,"[('Trump Unity Bridge', 'WORK_OF_ART'), ('11th', 'ORDINAL'), ('Penn', 'PERSON'), ('Harry’s Bar', 'PERSON'), ('Trump', 'ORG')]",0.2857142857142857,"[101, 8398, 8499, 2958, 9083, 2157, 2652, 2643, 19994, 2637, 6252, 9502, 4302, 2015, 3347, 8398, 3309, 102]"
